{
  "id": "semantic-contract.webhooks-developer-facing",
  "title": "Webhooks Developer Facing Semantic Contract",
  "description": "Source-backed draft semantic contract for the webhooks developer facing capability, recovered from historical React evidence as lineage. Facets cite verified source-import manifest rows; proof is hermetic/runtime lineage, not fresh USF proof.",
  "authorityLevel": "semantic-definition",
  "lifecycleState": "draft",
  "ontologyConcepts": [
    "Semantic Contract",
    "Capability",
    "Interface",
    "Event"
  ],
  "taxonomyRefs": [
    "semantic-architecture-classification"
  ],
  "vocabularyRefs": [
    "authority-levels",
    "lifecycle-states",
    "capability-domains"
  ],
  "aiGuidance": "Source-backed draft. Facet descriptions are concise source-backed summaries citing verified manifest rows; proof is hermetic/stale, not current readiness. Enrich facet detail and publish fresh proof before generation; respect the hexagonal constraint in ADR 0005.",
  "capability": "webhooks-developer-facing",
  "capabilityDomain": "developer-platform",
  "facets": {
    "lifecycle": {
      "status": "complete",
      "description": "Capability lifecycle recovered from cited React source as lineage.",
      "sourceRefs": [
        "apps/platform-api/src/usecases/webhook-worker.ts",
        "apps/platform-api/src/usecases/webhooks.ts"
      ]
    },
    "stateModel": {
      "status": "complete",
      "description": "State model recovered from cited React storage/port/adapter source.",
      "sourceRefs": [
        "apps/platform-api/src/db/migrations/019-tenant-webhooks.sql",
        "apps/platform-api/src/db/migrations/020-webhook-delivery-queue.sql"
      ]
    },
    "permissions": {
      "status": "complete",
      "description": "Permission and tenant-isolation model recovered from cited React source and tests.",
      "sourceRefs": [
        "apps/platform-api/tests/unit/webhook-worker.test.ts",
        "apps/platform-api/tests/unit/webhooks.test.ts"
      ]
    },
    "contracts": {
      "status": "complete",
      "description": "Operation/interface contracts recovered from cited React source behind ports/adapters.",
      "sourceRefs": [
        "apps/platform-api/src/server/webhook-worker-runtime.ts"
      ]
    },
    "validation": {
      "status": "complete",
      "description": "Validation recovered from cited React tests and source.",
      "sourceRefs": [
        "apps/platform-api/tests/unit/webhook-worker.test.ts",
        "apps/platform-api/tests/unit/webhooks.test.ts"
      ]
    },
    "errorModel": {
      "status": "complete",
      "description": "Deterministic fail-closed error outcomes recovered from cited React tests and source.",
      "sourceRefs": [
        "apps/platform-api/tests/unit/webhook-worker.test.ts",
        "apps/platform-api/tests/unit/webhooks.test.ts"
      ]
    },
    "auditModel": {
      "status": "complete",
      "description": "Audit-before-mutation behaviour recovered from cited React source and tests.",
      "sourceRefs": [
        "apps/platform-api/tests/unit/webhook-worker.test.ts",
        "apps/platform-api/tests/unit/webhooks.test.ts"
      ]
    },
    "readinessModel": {
      "status": "complete",
      "description": "Readiness posture recovered from cited React proof and tests; degrades explicitly when the substrate is unavailable.",
      "sourceRefs": [
        "apps/platform-api/scripts/notification-webhook-transport-runtime-proof.ts",
        "apps/platform-api/scripts/webhook-redrive-runtime-proof.ts"
      ]
    },
    "proof": {
      "status": "complete",
      "description": "Behaviour exercised by cited React proof and tests. Demonstrated in React via hermetic/runtime proof lineage; fresh USF proof pending USF-101/USF-59.",
      "sourceRefs": [
        "apps/platform-api/scripts/notification-webhook-transport-runtime-proof.ts",
        "apps/platform-api/scripts/webhook-redrive-runtime-proof.ts"
      ]
    },
    "uiSemanticDefinition": {
      "status": "complete",
      "description": "UI semantics recovered from cited React UI source.",
      "sourceRefs": [
        "apps/react-enterprise-app/src/features/admin-webhooks/AdminWebhooksPage.tsx",
        "apps/react-enterprise-app/src/features/admin-webhooks/__tests__/AdminWebhooksPage.test.tsx"
      ]
    }
  },
  "sourceRefs": [
    "docs/architecture/capability-source-coverage-matrix.md",
    "docs/architecture/react-l5-equivalence-audit.md",
    "apps/platform-api/scripts/notification-webhook-transport-runtime-proof.ts",
    "apps/platform-api/scripts/webhook-redrive-runtime-proof.ts",
    "apps/platform-api/scripts/webhook-worker-runtime-proof.ts",
    "apps/platform-api/scripts/webhooks-runtime-proof.ts",
    "apps/platform-api/src/adapters/http-webhook-dispatcher.ts",
    "apps/platform-api/src/adapters/postgres-webhook-store.ts",
    "apps/platform-api/src/db/migrations/019-tenant-webhooks.sql",
    "apps/platform-api/src/db/migrations/020-webhook-delivery-queue.sql",
    "apps/platform-api/src/ports/webhook-store.ts",
    "apps/platform-api/src/server/webhook-worker-runtime.ts",
    "apps/platform-api/src/usecases/webhook-worker.ts",
    "apps/platform-api/src/usecases/webhooks.ts"
  ],
  "adrRefs": [
    "docs/adr/0005-react-hexagonal-architecture-carry-forward.md"
  ]
}
